{
  "eventId": "evt_001",
  "timestamp": "2026-07-30T12:00:00Z",
  "actor": {
    "type": "human",
    "id": "researcher"
  },
  "action": "construct.mapping.approved",
  "objectId": "construct_shared_leadership",
  "beforeHash": "sha256:1111111111111111111111111111111111111111111111111111111111111111",
  "afterHash": "sha256:2222222222222222222222222222222222222222222222222222222222222222",
  "baseRevision": "sha256:3333333333333333333333333333333333333333333333333333333333333333",
  "resultingRevision": "sha256:4444444444444444444444444444444444444444444444444444444444444444"
}
